30. A company is using Amazon Elastic File System (Amazon EFS) to share a file system among several Amazon EC2 instances. As usage increases, users report that file retrieval from the EFS file system is slower than normal. Which action should a SysOps administrator take to improve the performance of the file system?  	A. Configure the file system for Provisioned Throughput. 	B. Enable encryption in transit on the file system. 	C. Identify any unused files in the file system, and remove the unused files. 	D. Resize the Amazon Elastic Block Store (Amazon EBS) volume of each of the EC2 instances. 	A
31. A SysOps administrator is helping a development team deploy an application to AWS Trie AWS CloudFormat on temp ate includes an Amazon Linux EC2 Instance an Amazon Aurora DB cluster and a hard coded database password that must be rotated every 90 days What is the MOST secure way to manage the database password? 	A. Use the AWS SecretsManager Secret resource with the GenerateSecretString property to automatically generate a password Use the AWS SecretsManager RotationSchedule resource lo define a rotation schedule lor the password Configure the application to retrieve the secret from AWS Secrets Manager access the database	B. Use me AWS SecretsManager Secret resource with the SecretStrmg property Accept a password as a CloudFormation parameter Use the AllowedPatteen property of the CloudFormaton parameter to require e minimum length, uppercase and lowercase letters and special characters Configure me application to retrieve the secret from AWS Secrets Manager to access the database 	C. Use the AWS SSM Parameter resource Accept input as a Qoudformatton parameter to store the parameter as a secure sting Configure the application to retrieve the parameter from AWS Systems Manager Parameter Store to access the database 	D. Use the AWS SSM Parameter resource Accept input as a Cloudf ormetton parameter to store the parameter as a string Configure the application to retrieve the parameter from AWS Systems Manager Parameter Store to access the database 	A
32. An application team uses an Amazon Aurora MySQL DB cluster with one Aurora Replic a. The application team notices that the application read performance degrades when user connections exceed 200. The number of user connections is typically consistent around 180. with occasional sudden increases above 200 connections. The application team wants the application to automatically scale as user demand increases or decreases. Which solution will meet these requirements?	A. Migrate to a new Aurora multi-master DB cluster. Modify the application database connection string	B. Modify the DB cluster by changing to serverless mode whenever user connections exceed 200	C. Create an auto scaling policy with a target metric of 195 DatabaseConnection	D. Modify the DB cluster by increasing the Aurora Replica instance size.	C
33. A company's SysOps administrator has created an Amazon EC2 instance with custom software that will be used as a template for all new EC2 instances across multiple AWS accounts. The Amazon Elastic Block Store (Amazon EBS) volumes that are attached to the EC2 instance are encrypted with AWS managed keys. The SysOps administrator creates an Amazon Machine Image (AMI) of the custom EC2 instance and plans to share the AMI with the company's other AWS accounts. The company requires that all AMIs are encrypted with AWS Key Management Service (AWS KMS) keys and that only authorized AWS accounts can access the shared AMIs. Which solution will securely share the AMI with the other AWS accounts	A. In the account where the AMI was created, create a customer master key (CMK). Modify the key policy to provide kms:DescribeKey, kms ReEncrypf, kms:CreateGrant, and kms:Decrypt permissions to the AWS accounts that the AMI will be shared with. Modify the AMI permissions to specify the AWS account numbers that the AMI will be shared with.	B. In the account where the AMI was created, create a customer master key (CMK). Modify the key policy to provide kms:DescribeKey, kms:ReEncrypt*. kms:CreateGrant, and kms;Decrypt permissions to the AWS accounts that the AMI will be shared with. Create a copy of the AMI. and specify the CMK. Modify the permissions on the copied AMI to specify the AWS account numbers that the AMI will be shared with.	C. In the account where the AMI was created, create a customer master key (CMK). Modify the key policy to provide kms:DescrlbeKey, kms:ReEncrypt\ kms:CreateGrant, and kms:Decrypt permissions to the AWS accounts that the AMI will be shared with. Create a copy of the AMI. and specify the CMK. Modify the permissions on the copied AMI to make it public.	D. In the account where the AMI was created, modify the key policy of the AWS managed key to provide kms:DescnbeKey. kms:ReEncrypt\ kms:CreateGrant, and kms:Decrypt permissions to the AWS accounts that the AMI will be shared with. Modify the AMI permissions to specify the AWS account numbers that the AMI will be shared with.	B 
34. A SysOps administrator is provisioning an Amazon Elastic File System (Amazon EFS) file system to provide shared storage across multiple Amazon EC2 instances The instances all exist in the same VPC across multiple Availability Zones. There are two instances In each Availability Zone. The SysOps administrator must make the file system accessible to each instance with the lowest possible latency. Which solution will meet these requirements?	A. Create a mount target for the EFS file system in the VPC. Use the mount target to mount the file system on each of the instance	B. Create a mount target for the EFS file system in one Availability Zone of the VPC. Use the mount target to mount the file system on the instances in that Availability Zone. Share the directory with the other instances.	C. Create a mount target for each instance. Use each mount target to mount the EFS file system on each respective instance.	D. Create a mount target in each Availability Zone of the VPC Use the mount target to mount the EFS file system on the Instances in the respective Availability Zone.	D
35. A SysOps administrator has used AWS Cloud Formal ion to deploy a serverless application Into a production VPC. The application consists of an AWS Lambda function an Amazon DynamoDB table, and an Amazon API Gateway API. The SysOps administrator must delete the AWS Cloud Formation stack without deleting the DynamoDB table. Which action should the SysOps administrator take before deleting the AWS Cloud Formation stack? 	A. Add a Retain deletion policy to the DynamoDB resource in the AWS CloudFormation stack	B. Add a Snapshot deletion policy to the DynamoDB resource in the AWS CloudFormation stack.	C. Enable termination protection on the AWS Cloud Formation stack.	D. Update the application's IAM policy with a Deny statement for the dynamodb:DeleteTabie action.	A
36. A SysOps administrator Is troubleshooting an AWS Cloud Formation template whereby multiple Amazon EC2 instances are being created The template is working In us-east-1. but it is failing In us- west-2 with the error code: How should the administrator ensure that the AWS Cloud Formation template is working in every region?	A. Copy the source region's Amazon Machine Image (AMI) to the destination region and assign it the same ID. 	B. Edit the AWS CloudFormatton template to specify the region code as part of the fully qualified AMI ID. 	C. Edit the AWS CloudFormatton template to offer a drop-down list of all AMIs to the user by using the aws :: EC2:: ami :: imageiD control. 	D. Modify the AWS CloudFormation template by including the AMI IDs in the "Mappings" section. Refer to the proper mapping within the template for the proper AMI ID.	A
37. A company runs us Infrastructure on Amazon EC2 Instances that run In an Auto Scaling group. Recently, the company promoted faulty code to the entire EC2 fleet. This faulty code caused the Auto Scaling group to scale the instances before any of the application logs could be retrieved. What should a SysOps administrator do to retain the application logs after instances are terminated?	A Configure an Auto Scaling lifecycle hook to create a snapshot of the ephemeral storage upon termination of the instances.	B. Create a new Amazon Machine Image (AMI) that has the Amazon CloudWatch agent installed and configured to send logs to Amazon CloudWatch Logs. Update the launch template to use the new AMI.	C. Create a new Amazon Machine Image (AMI) that has a custom script configured to send logs to AWS CloudTrail. Update the launch template to use the new AMI.	D. Install the Amazon CloudWatch agent on the Amazon Machine Image (AMI) that is defined in the launch template. Configure the CloudWatch agent to back up the logs to ephemeral storage.	B
38. A company has a critical serverless application that uses multiple AWS Lambda functions. Each Lambda function generates 1 GB of log data daily in tts own Amazon CloudWatch Logs log group. The company's security team asks for a count of application errors, grouped by type, across all of the log groups. What should a SysOps administrator do to meet this requirement? 	A. Perform a CloudWatch Logs Insights query that uses the stats command and count function.	B. Perform a CloudWatch Logs search that uses the groupby keyword and count function.	C. Perform an Amazon Athena query that uses the SELECT and GROUP BY keywords.	D. Perform an Amazon RDS query that uses the SELECT and GROUP BY keywords. 	A
39. A company monitors its account activity using AWS CloudTrail. and is concerned that some log files are being tampered with after the logs have been delivered to the account's Amazon S3 bucket. Moving forward, how can the SysOps administrator confirm that the log files have not been modified after being delivered to the S3 bucket? 	A. Stream the CloudTrail logs to Amazon CloudWatch Logs to store logs at a secondary location.	B. Enable log file integrity validation and use digest files to verify the hash value of the log file.	C. Replicate the S3 log bucket across regions, and encrypt log files with S3 managed keys.	D. Enable S3 server access logging to track requests made to the log bucket for security audits.	B
40. A team of On-call engineers frequently needs to connect to Amazon EC2 Instances In a private subnetto troubleshoot and run commands. The Instances use either the latest AWS-provided Windows Amazon Machine Images (AMIs) or Amazon Linux AMIs. The team has an existing IAM role for authorization. A SysOps administrator must provide the team with access to the Instances by granting IAM permissions to this Which solution will meet this requirement?  	A. Add a statement to the IAM role policy to allow the ssm:StartSession action on the instances. Instruct the team to use AWS Systems Manager Session Manager to connect to the Instances by using the assumed IAM role. 	B. Associate an Elastic IP address and a security group with each instance. Add the engineers' IP addresses to the security group inbound rules. Add a statement to the IAM role policy to allow the ec2:AuthoflzeSecurityGroupIngress action so that the team can connect to the Instances. 	C. Create a bastion host with an EC2 Instance, and associate the bastion host with the VPC. Add a statement to the IAM role policy to allow the ec2:CreateVpnConnection action on the bastion host. Instruct the team to use the bastion host endpoint to connect to the instances. 	D Create an internet-facing Network Load Balancer. Use two listeners. Forward port 22 to a target group of Linux instances. Forward port 3389 to a target group of Windows Instances. Add a statement to the IAM role policy to allow the ec2:CreateRoute action so that the team can connect to the Instances.	A
41. A company has an AWS Cloud Formation template that creates an Amazon S3 bucket. A user authenticates to the corporate AWS account with their Active Directory credentials and attempts to deploy the Cloud Formation template. However, the stack creation fails. Which factors could cause this failure? (Select TWO.) 	A. The user's IAM policy does not allow the cloudformation:CreateStack action.	B. The user's IAM policy does not allow the cloudformation:CreateStackSet action.	C. The user's IAM policy does not allow the s3:CreateBucket action.	D. The user's IAM policy explicitly denies the s3:ListBucket action.	E. The user's IAM policy explicitly denies the s3:PutObject action	AC
42. A company runs a web application on three Amazon EC2 instances behind an Application Load Balancer (ALB). The company notices that random periods of increased traffic cause a degradation in the application's performance. A SysOps administrator must scale the application to meet the increased traffic. Which solution meets these requirements? 	A. Create an Amazon CloudWatch alarm to monitor application latency and increase the size of each EC2 instance If the desired threshold is reached.	B. Create an Amazon EventBridge (Amazon CloudWatch Events) rule to monitor application latency and add an EC2 instance to the ALB if the desired threshold is reached.	C. Deploy the application to an Auto Scaling group of EC2 instances with a target tracking scaling policy. Attach the ALB to the Auto Scaling group.	D. Deploy the application to an Auto Scaling group of EC2 instances with a scheduled scaling policy. Attach the ALB to the Auto Scaling group.	C
43. A company has a new requirement stating that all resources In AWS must be tagged according to a set policy. Which AWS service should be used to enforce and continually Identify all resources that are not in compliance with the policy? 	A. AWS CloudTrail	B. Amazon Inspector	C. AWS Config	D. AWS Systems Manager	C
44. A SysOps administrator is setting up an automated process to recover an Amazon EC2 instance In the event of an underlying hardware failure. The recovered instance must have the same private IP address and the same Elastic IP address that the original instance had. The SysOps team must receive an email notification when the recovery process is initiated. Which solution will meet these requirements? 	A. Create an Amazon CloudWatch alarm for the EC2 instance, and specify the SiatusCheckFailedjnstance metric. Add an EC2 action to the alarm to recover the instance. Add an alarm notification to publish a message to an Amazon Simple Notification Service (Amazon SNS> topic. Subscribe the SysOps team email address to the SNS topic.	B. Create an Amazon CloudWatch alarm for the EC2 Instance, and specify the StatusCheckFailed_System metric. Add an EC2 action to the alarm to recover the instance. Add an alarm notification to publish a message to an Amazon Simple Notification Service (Amazon SNS) topic. Subscribe the SysOps team email address to the SNS topic.	C. Create an Auto Scaling group across three different subnets in the same Availability Zone with a minimum, maximum, and desired size of 1. Configure the Auto Seating group to use a launch template that specifies the private IP address and the Elastic IP address. Add an activity notification for the Auto Scaling group to send an email message to the SysOps team through Amazon Simple Email Service (Amazon SES).	D. Create an Auto Scaling group across three Availability Zones with a minimum, maximum, and desired size of 1. Configure the Auto Scaling group to use a launch template that specifies the private IP address and the Elastic IP address. Add an activity notification for the Auto Scaling group to publish a message to an Amazon Simple Notification Service (Amazon SNS) topic. Subscribe the SysOps team email address to the SNS topic. 	B
45. A SysOps administrator must create a solution that immediately notifies software developers if an AWS Lambda function experiences an error. Which solution will meet this requirement? 	A. Create an Amazon Simple Notification Service (Amazon SNS) topic with an email subscription for each developer. Create an Amazon CloudWatch alarm by using the Errors metric and the Lambda function name as a dimension. Configure the alarm to send a notification to the SNS topic when the alarm state reaches ALARM. 	B. Create an Amazon Simple Notification Service (Amazon SNS) topic with a mobile subscription for each developer. Create an Amazon EventBridge (Amazon CloudWatch Events) alarm by using LambdaError as the event pattern and the SNS topic name as a resource. Configure the alarm to send a notification to the SNS topic when the alarm state reaches ALARM. 	C. Verify each developer email address in Amazon Simple Email Service (Amazon SES). Create an Amazon CloudWatch rule by using the LambdaError metric and developer email addresses as dimensions. Configure the rule to send an email through Amazon SES when the rule state reaches ALARM. 	D. Verify each developer mobile phone in Amazon Simple Email Service {Amazon SES). Create an Amazon EventBridge (Amazon CloudWatch Events) rule by using Errors as the event pattern and the Lambda function name as a resource. Configure the rule to send a push notification through Amazon SES when the rule state reaches ALARM. 	A
46. A SysOps administrator developed a Python script that uses the AWS SDK to conduct several maintenance tasks. The script needs to run automatically every night. What is the MOST operationally efficient solution that meets this requirement? 	A. Convert the Python script to an AWS Lambda (unction. Use an Amazon EventBridge (Amazon CloudWatch Events) rule to invoke the function every night.	B. Convert the Python script to an AWS Lambda function. Use AWS CloudTrail to invoke the function every night.	C. Deploy the Python script to an Amazon EC2 Instance. Use Amazon EventBridge (Amazon CloudWatch Events) to schedule the instance to start and stop every night.	D. Deploy the Python script to an Amazon EC2 instance. Use AWS Systems Manager to schedule the instance to start and stop every night. 	A
47. A SysOps administrator must create a solution that automatically shuts down any Amazon EC2 instances that have less than 10% average CPU utilization for 60 minutes or more. Which solution will meet this requirement In the MOST operationally efficient manner? 	A. Implement a cron job on each EC2 instance to run once every 60 minutes and calculate the current CPU utilization. Initiate an instance shutdown If CPU utilization is less than 10%.	B. Implement an Amazon CloudWatch alarm for each EC2 instance to monitor average CPU utilization. Set the period at 1 hour, and set the threshold at 10%. Configure an EC2 action on the alarm to stop the instance.	C. Install the unified Amazon CloudWatch agent on each EC2 instance, and enable the Basic level predefined metric set. Log CPU utilization every 60 minutes, and initiate an instance shutdown if CPU utilization is less than 10%.	D. Use AWS Systems Manager Run Command to get CPU utilization from each EC2 instance every 60 minutes. Initiate an instance shutdown if CPU utilization is less than 10%. 	B
48. A company uses AWS Cloud Formation templates to deploy cloud infrastructure. An analysis of all the company's templates shows that the company has declared the same components in multiple templates. A SysOps administrator needs to create dedicated templates that have their own parameters and conditions for these common components. Which solution will meet this requirement? 	A. Develop a CloudFormaiion change set.	B. Develop CloudFormation macros.	C. Develop CloudFormation nested stacks.	D. Develop CloudFormation stack sets. 	C
49. A company has deployed AWS Security Hub and AWS Config in a newly implemented organization in AWS Organizations. A SysOps administrator must implement a solution to restrict all member accounts in the organization from deploying Amazon EC2 resources in the ap-southeast-2 Region. The solution must be implemented from a single point and must govern an current and future accounts. The use of root credentials also must be restricted in member accounts. Which AWS feature should the SysOps administrator use to meet these requirements? 	A. AWS Config aggregator	B. IAM user permissions boundaries	C. AWS Organizations service control policies (SCPs)	D. AWS Security Hub conformance packs 	C
50. A company has a new requirement stating that all resources in AWS must be tagged according to a set policy. Which AWS service should be used to enforce and continually identify all resources that are not in compliance with the policy? 	A. AWS CloudTrail	B. Amazon Inspector	C. AWSConfig	D. AWS Systems Manager 	C
51. A SysOps administrator has used AWS Cloud Formation to deploy a sereness application into a production VPC. The application consists of an AWS Lambda function, an Amazon DynamoOB table, and an Amazon API Gateway API. The SysOps administrator must delete the AWS Cloud Formation stack without deleting the DynamoOB table.  Which action should the SysOps administrator take before deleting the AWS Cloud Formation stack? 	A. Add a Retain deletion policy to the DynamoOB resource in the AWS CloudFormation stack.	B. Add a Snapshot deletion policy to the DynamoOB resource In the AWS CloudFormation stack.	C. Enable termination protection on the AWS Cloud Formation stack.	D. Update the application's IAM policy with a Deny statement for the dynamodb:DeleteTabie action. 	A
52. A company has a critical serverless application that uses multiple AWS Lambda functions. Each Lambda function generates 1 GB of log data daily in its own Amazon CloudWatch Logs log group. The company's security team asks for a count of application errors, grouped by type, across all of the log groups. What should a SysOps administrator do to meet this requirement? 	A. Perform a CloudWatch Logs Insights query that uses the stats command and count function.	B. Perform a CloudWatch Logs search that uses the groupby keyword and count function.	C. Perform an Amazon Athena query that uses the SELECT and GROUP BY keywords.	D. Perform an Amazon RDS query that uses the SELECT and GROUP BY keywords. 	A
53. A SysOps administrator needs to give users the ability to upload objects to an Amazon S3 bucket. The SysOps administrator creates a presigned URL and provides the URL to a user, but the user cannot upload an object to the S3 bucket. The presigned URL has not expired, and no bucket policy is applied to the S3 bucket. Which of the following could be the cause of this problem? 	A. The user has not properly configured the AWS CLI with their access key and secret access key.	B. The SysOps administrator does not have the necessary permissions to upload the object to the S3 bucket.	C. The SysOps administrator must apply a bucket policy to the S3 bucket to allow the user to upload the object.	D. The object already has been uploaded through the use of the presigned URL, so the presigned URL is no longer valid. 	B
54. A SysOps administrator is responsible for a legacy. CPU-heavy application The application can only be scaled vertically Currently, the application is deployed on a single t2 large Amazon EC2 instance The system is showing 90% CPU usage and significant performance latency after a few minutes What change should be made to alleviate the performance problem? 	A. Change the Amazon EBS volume to Provisioned lOPs	B. Upgrade to a compute-optimized instance	C. Add additional 12 large instances to the application	D. Purchase Reserved Instances	B
55. A company is tunning a website on Amazon EC2 instances thai are in an Auto Scaling group When the website traffic increases, additional instances lake several minutes to become available because ot a long-running user data script that installs software A SysOps administrator must decrease the time that is required (or new instances to become available Which action should the SysOps administrator take to meet this requirement? 	A. Reduce the scaling thresholds so that instances are added before traffic increases	B. Purchase Reserved Instances to cover 100% of the maximum capacity of the Auto Scaling group	C. Update the Auto Scaling group to launch instances that have a storage optimized instance type	D. Use EC2 Image Builder to prepare an Amazon Machine Image (AMI) that has pre-installed software 	D
56. A SysOps administrator is notified that an Amazon EC2 instance has stopped responding The AWS Management Console indicates that the system status checks are failing What should the administrator do first to resolve this issue?	A. Reboot the EC2 instance so it can be launched on a new host 	B. Stop and then start the EC2 instance so that it can be launched on a new hos	C. Terminate the EC2 instance and relaunch it 	D. View the AWS CloudTrail log to investigate what changed on the EC2 instance 	B
57. A SysOps administrator has enabled AWS CloudTrail in an AWS account If CloudTrail is disabled it must be re-enabled immediately What should the SysOps administrator do to meet these requirements WITHOUT writing custom code'' 	A. Add the AWS account to AWS Organizations Enable CloudTrail in the management account	B. Create an AWS Config rule that is invoked when CloudTrail configuration changes Apply the AWS- ConfigureCloudTrailLogging automatic remediation action	C. Create an AWS Config rule that is invoked when CloudTrail configuration changes Configure the rule to invoke an AWS Lambda function to enable CloudTrail	D. Create an Amazon EventBridge (Amazon CloudWatch Events) hourly rule with a schedule pattern to run an AWS Systems Manager Automation document to enable CloudTrail 	B
58. A recent audit found that most resources belonging to the development team were in violation of patch compliance standards The resources were properly tagged Which service should be used to quickly remediate the issue and bring the resources back into compliance? 	A. AWS Config	B. Amazon Inspector	C. AWS Trusted Advisor	D. AWS Systems Manager	D 
